Grande Ponto Do Construtor,Casa de Material de Construção,Nova Parnamirim,(84) 3208-8415,"Av Maria Lacerda Montenegro, 2475",59152-600
A Flor Da Pele Decorações Romanticas,Decoradores,Praia do Meio,(84) 3202-1534,"Av Vinte e Cinco de Dezembro, 149",59010-030
Lavanderia Fino Trato,Lavanderias,Pitimbu,(84) 3218-2913,"R Lago da Pedra, 1004",59068-600
Pateo Comércio De Veículos,Agências e Revendedores de Automóveis,Dix-sept Rosado,(84) 3223-8501,"R Baraúna, 1820",59054-370
Unidade Mista De Mãe Luíza,Secretarias Públicas,Mãe Luíza,(84) 3232-8625,"Tv João XXIII,",59014-005
Peça Fácil Autopeças Comercial,Autopeças e Acessórios,Alecrim,(84) 3223-9090,"R Doutor Mário Negócio, 1495",59040-000
Pg Prime,Centros Automotivos,Ribeira,(84) 4009-4600,"Av Rio Branco, 171",59012-000
Alpha Recepções,Buffet e Salões para Eventos e Festas,Candelária,(84) 3207-4923,"R Prefeito Sandoval C de Albuquerque, 526",59064-735
Texas,Equipamentos e Acessórios de Informática,Lagoa Nova,(84) 3611-0008,"R Romualdo Galvão, 952",59056-100
Cdr Comércio E Representações Em Telecomunicações,Assistência Técnica para Celulares,Capim Macio,(84) 3219-2004,"Av Engenheiro Roberto Freire, 8790 - lj-4",59082-400
Seneuro,Clínicos Gerais,Petrópolis,(84) 3212-1893,"Av Afonso Pena, 960",59020-065
Fio Trancado,Lojas de Enxoval,Lagoa Nova,(84) 3211-3364,"R Romualdo Galvão, 1048",59056-100
Comercial Ana Luz,Casa de Material de Construção,Alecrim,(84) 3213-9364,"R dos Canindés, 1481",59030-600
Delícias Express,Doces e Salgados,Quintas,(84) 3223-3292,"R Presidente Leão Veloso, 701",59035-500
Potiguar Empreendimentos Imobiliários,Empreendimentos Imobiliários,Candelária,(84) 3207-4483,"Av Dão Silveira, 7940",59066-180
Posto São Rafael,Postos de Combustíveis,Alecrim,(84) 3611-0510,"Av Coronel Estevam, 1155",59030-000
S J Comércio Representações E Imóveis,Assessoria para Comércio Exterior,Lagoa Seca,(84) 3211-6606,"Av Prudente de Morais, 2657 - s-101",59022-310
Cepp Centro De Educação E Planejamento Profissional,Cursos Jurídicos,Tirol,(84) 3611-9224,"R Açu, 572",59020-110
Funcern - Fundação Apoio Educação Desen Tecnológico Rn,Institutos e Fundações,Tirol,(84) 3215-2729,"Av Senador Salgado Filho, 1559",59015-000
Site Informática,Equipamentos e Acessórios de Informática,Capim Macio,(84) 3213-0917,"Av Engenheiro Roberto Freire, 2951 - bl-2 lj-13",59078-600
Clínica Tirol,Clínicos Gerais,Tirol,(84) 3221-0322,"Av Rodrigues Alves, 1155",59020-200
Hotel Pousada Azurra,Pousadas,Ponta Negra,(84) 3311-3456,"Av Erivan França, 199",59090-100
Silvana Mariza Bongiovanni De Andrade Ferrari,Dentistas,Lagoa Nova,(84) 3234-5325,"Av Amintas Barros, 2935",59054-830
Classe A Veículos,Adaptação de Veículos para Deficientes Físicos,Alecrim,(84) 3213-4496,"R dos Canindés, 1275",59030-600
Casa Do Pão De Queijo,Lanchonetes,Petrópolis,(84) 3201-1926,"R Seridó, 513",59020-010
New Comunicação,Agências de Publicidade e Propaganda,Capim Macio,(84) 3217-0121,"Av Professor João Machado, 2875",59078-340
Natal Locadora Viagens E Turismo,"Aluguel de Ônibus, Micro-ônibus e Vans",Lagoa Nova,(84) 3231-4421,"Av Amintas Barros, 2577",59054-465
Jct Distribuidora De Cartões Telemar E Oi,Serviços de Distribuição,Tirol,(84) 3211-3361,"Av Prudente de Morais, 744 - s-909",59020-510
Ps Esporte,Atacado e Fabricação de Artigos de Equipamentos Esportivos,Alecrim,(84) 3213-7087,"Av Coronel Estevam, 1355 - lj-59",59031-000
Secretaria Municipal De Saúde,Secretarias Públicas,Igapó,(84) 3232-8260,"R Irmã Vitória, 706",59106-020
Bagatelle,Lojas de Roupas Femininas,Petrópolis,(84) 3222-0100,"Av Afonso Pena, 510",59020-065
Bagatelle,Lojas de Roupas Femininas,Petrópolis,(84) 3222-0100,"Av Afonso Pena, 510",59020-065
Global Serviços De Cobrança,Agências de Cobrança,Barro Vermelho,(84) 4006-2650,"R Romualdo Galvão, 173 - s-311",59022-100
Cacau Show,Lojas de Chocolate,Igapó,(84) 3674-8484,"Av Doutor João Medeiros Filho, 23",59104-200
Supermercado Bom Jesus,Supermercados,Potengi,(84) 3661-8195,"Av Governador Antônio de Melo e Souza, 2370",59125-090
Cacau Show,Lojas de Chocolate,Tirol,(84) 3646-3434,"Av Bernardo Vieira, 3775 - lj-113",59015-900
Radikal Chic,Salões de Beleza e Cabeleireiros,Nova Parnamirim,(84) 3208-3722,"Av Maria Lacerda Montenegro, 809 - lj-8",59152-600
Sindicato Trabalhadores Saúde Rio Grande Norte,Sindicatos e Federações,Cidade Alta,(84) 3212-2314,"Av Rio Branco, 874",59025-002
Grupo De Teatro Clowns De Shakespeare,Teatros,Lagoa Nova,(84) 3221-1816,"R Monsenhor Amâncio Ramalho, 8",59056-080
Tnt Cartuchos,Comércio de Cartuchos e Toner para Impressoras,Felipe Camarão,(84) 3201-6921,"R Felipe Camarão, 499",59072-740
Couromania,Lojas de Calçados,Lagoa Nova,(84) 3206-6284,"Av Amintas Barros, 2909 - lj-3",59054-830
Rafamax Solutions,Sistemas de Sinalização,Cidade Alta,(84) 4141-5337,"Av Rio Branco, 777 - s-5",59025-003
Helotur,Agências de Turismo e Viagens,Lagoa Nova,(84) 3221-4329,"Av Miguel Castro, 495",59075-740
Restaurante Cassol,Restaurante,Tirol,(84) 3344-4942,"Av Bernardo Vieira, 3775 - lj-202A",59015-900
Sesc Restaurante,Restaurante,Cidade Alta,(84) 3211-4615,"Av Rio Branco, 375",59025-001
Center Atacado,Papelarias,Alecrim,(84) 3216-4150,"R Presidente Quaresma, 512",59031-150
Razão Contabilidade,Contadores e Escritórios de Contabilidade,Alecrim,(84) 3201-0789,"R Presidente Quaresma, 974 - s-04",59031-150
Maria Das Graças Melo De Araújo,Pediatras e Pediatria,Tirol,(84) 3222-8168,"R Monsenhor José Paulino, 1070",59022-200
Coisseur Pour Damas,Salões de Beleza e Cabeleireiros,Capim Macio,(84) 3206-3323,"Av Senador Salgado Filho, 2233 - lj-743A",59078-901
Ponto Das Caixas De Marcha,Oficinas Mecânicas,Nossa Senhora Nazaré,(84) 3654-2245,"Av Coronel Estevam, 2128",59062-200
Espaço 2 Business Escritório Virtual,Escritórios Virtuais,Tirol,(84) 2010-3438,"Av Hermes da Fonseca, 1596 - lj-21",59020-650
Vip Cartuchos & Informática,Comércio de Cartuchos e Toner para Impressoras,Pitimbu,(84) 3218-3327,"Av dos Xavantes, 769",59067-600
Laboratório D N A Center,Laboratórios de Análises Clínicas,Petrópolis,(84) 3201-2204,"Av Afonso Pena, 910",59020-065
Tributo A Criança Mãe Luíza,Administração Pública,Petrópolis,(84) 3232-4975,"R Cônego Leão Fernandes, 554",59020-060
Enco Engenharia Construção E Comércio,Construção Civil,Lagoa Nova,(84) 3206-0076,"Av Prudente de Morais, 3857 - lj-30",59056-902
Promonat,Imobiliárias,Ponta Negra,(84) 3219-2116,"Av Praia de Ponta Negra, 8968",59094-100
Sacolão Loja Virtual,Lojas de Cosméticos e Perfumarias,Dix-sept Rosado,(84) 2226-0404,"Av Antônio Basílio, 1095",59052-475
Farmácias Irma Dulce,Farmácias e Drogarias,Ponta Negra,(84) 3641-1450,"R Vereador Manoel Coringa de Lemos, 135",59090-190
Dejavue Floricultura,Floriculturas,Nova Parnamirim,(84) 3643-3938,"Av Maria Lacerda Montenegro, 482",59152-600
Cdi - Centro De Desenvolvimento Integrado,Psicólogos,Tirol,(84) 3081-3623,"R Desembargador Antônio Soares, 1239 - c-A",59022-170
Lojão Do Chevrolet,Centros Automotivos,Alecrim,(84) 3615-1011,"R Presidente José Bento, 459",59037-060
Maria De Lourdes Melo Kaiser,Empresas Variadas,Capim Macio,(84) 3217-6772,"Av Odilon Gomes de Lima, 2013",59078-400
Arla Instituto De Beleza,Salões de Beleza e Cabeleireiros,Alecrim,(84) 3213-2020,"R Castro Alves, 605",59032-480
Colégio Evolução De Natal,Escolas,Potengi,(84) 3662-3811,"R Nova Friburgo, 2826",59110-040
Ideal Segurança Eletrônica,Monitoramento e Segurança Eletrônica,Planalto,(84) 3082-1033,"R Monte Rei, 103",59073-150
Compre Fácil,Comércio de Brinquedos,Alecrim,(84) 3213-8608,"Av Coronel Estevam, 1319",59031-000
Chocolândia,Docerias,Potengi,(84) 3214-6567,"Av Maranguape, 1071",59112-000
Fitta Câmbio,Intercâmbio Cultural,Tirol,(84) 3201-0713,"Av Afonso Pena, 672 - lj-5",59020-100
Drogaria Nova Dimensão,Farmácias e Drogarias,Potengi,(84) 3203-2111,"Av Itapetinga, 685",59124-400
Canasse,"Comércio de Papel Velho, Aparas e Resíduos",Alecrim,(84) 3653-2377,"R Manoel Miranda, 1402",59037-250
Cidade Color,"Ampliações, Cópias e Revelações de Fotos",Candelária,(84) 3216-5293,"Av Prudente de Morais, 6425",59065-305
Tirol Fórmula K,Autopeças e Acessórios,Lagoa Seca,(84) 3213-4110,"R Tenente Brandão, 918",59031-030
C & A,Lojas de Roupas Unissex,Tirol,(84) 4009-0001,"Av Bernardo Vieira, 3775 - lj-111 pi-L1",59015-900
Oficina Canaã,Oficinas Mecânicas,Nossa Senhora Nazaré,(84) 3223-5434,"Av Amintas Barros, 724",59062-195
Comercial Trindade,Papelarias,Pitimbu,(84) 3218-8451,"R Deputado Marcílio Furtado, 376 - lj-2",59069-470
Centro De Estudos E Assistência Odontológica,Clínicas Odontológicas,Tirol,(84) 3221-5039,"R General Oliveira Galvão, 1103",59015-120
Amantes Do Açaí,Lanchonetes,Neópolis,(84) 3207-4224,"Av Ayrton Senna, 2912",59088-100
Esperança Refrigeração,Ar-Condicionado Automotivo,Cidade da Esperança,(84) 3205-5384,"R Bayeux, 34",59070-160
Livraria E Papelaria Santana,Livrarias,Alecrim,(84) 3223-3237,"R Presidente Quaresma, 845",59031-150
Cercred - Central De Recuperação De Créditos,Serviços de Proteção Ao Crédito,Tirol,(84) 3087-7850,"Av Prudente de Morais, 744 - s-604",59020-510
Varejão Gaby,Armarinhos e Aviamentos,Cidade da Esperança,(84) 3205-0029,"Av Rio Grande do Norte, 1",59070-500
Bandeira & Associados,Assessoria Empresarial,Barro Vermelho,(84) 3201-4141,"R Romualdo Galvão, 773 - s-1206",59022-100
Sinalize Sinalização E Comunicação Visual,Sistemas de Sinalização,Lagoa Seca,(84) 3223-5324,"Av Bernardo Vieira, 2921",59022-385
Sam's Club,Supermercados Atacadistas,Candelária,(84) 3311-6200,"Av Dão Silveira, 4500",59066-180
Magna Locações,Construção Civil,Candelária,(84) 3217-1216,"R Pastor Manoel Leão, 1296",59066-240
Eletrobat,Baterias Automotivas,Dix-sept Rosado,(84) 3082-4222,"Tv Manoel Felipe, 2078",59054-196
Valdir Veículos,Agências e Revendedores de Automóveis,Alecrim,(84) 3213-1764,"R dos Canindés, 1396 - c-A",59030-600
Decisão Contábil,Contadores e Escritórios de Contabilidade,Neópolis,(84) 2030-5780,"R Paineiras, 4611",59088-460
Globo Maquinas,Assistência Técnica para Máquinas de Costura,Alecrim,(84) 3082-8874,"R dos Caicós, 1245",59031-700
Drogaria R. Dantas,Farmácias e Drogarias,Lagoa Azul,(84) 98719-8332,"R Tijuana, 301 - LOJA C",59139-350
Nn Service Car,Centros Automotivos,Candelária,(84) 98863-0664,"Av Governador Tarcísio de Vasconcelos Maia, 2000",59066-035
Farmácia Irma Dulce,Farmácias e Drogarias,Potengi,(84) 3203-5200,"Av Governador Antônio de Melo e Souza, 2172 - AL",59125-090
Wellington De Oliveira Júnior Comércio Varejista Do Rn,Roupas e Artigos,Alecrim,(84) 3223-6414,"R dos Canindés, 1345 - LJ 1",59030-600
Carmen Steffens,Lojas de Calçados,Tirol,(84) 3646-3027,"Av Bernardo Vieira, 3775 - LJ 271 A",59015-900
Bomboniere Ki - Mel,Empresas Variadas,Pajuçara,(84) 3663-3811,"Av Comunidade em Ação, 31 - LOT JARDIM BRASIL",59131-515
Editora Campo Novo,Editoras,Cidade Alta,(84) 3211-1169,"R José de Alencar, 838",59025-140
Alves Duarte E Advogados,Escritórios de Advocacia,Petrópolis,(84) 3201-2249,"R Potengi, 383",59020-030
Condomínio Residencial Dolce Vitta,Condomínios,Ponta Negra,(84) 3237-2014,"R João Tó, 296",59090-511
Pontual Contadores Associados,Contadores e Escritórios de Contabilidade,Candelária,(84) 98117-3871,"R Carlos Chagas, 3493",59065-220
Santa Luzia Transportes,Transporte Rodoviário,Nossa Senhora Nazaré,(84) 99982-4627,"Av Lima e Silva, 1271 - SL 111",59062-300
Farmácia Irma Dulce,Farmácias e Drogarias,Ponta Negra,(84) 3203-5200,"R Vereador Manoel Coringa de Lemos, 199",59090-190
Frank Acessórios,Autopeças e Acessórios,Igapó,(84) 99926-7619,"R Pacatuba, 2064",59104-380
Biroska Restaurante,Restaurante,Lagoa Nova,(84) 99962-1354,"R da Ametista, 2388 - LT 31",59076-300
Dinâmica Serigrafia E Gráfica,Agências de Publicidade e Propaganda,Cidade Alta,(84) 99129-0676,"R Padre Pinto, 763 - SL 101",59025-610
Pacioli - Contadores Associados,Contadores e Escritórios de Contabilidade,Lagoa Nova,(84) 98704-4545,"Av Amintas Barros, 2909 - SL 14",59054-830
Wgm Transportes E Logística,Transporte Rodoviário,Alecrim,(84) 98802-0321,"R Presidente Quaresma, 725 - ANDAR 1 SALA 03",59031-150
Wgm Transportes E Logística,Transporte Rodoviário,Alecrim,(84) 98802-0321,"R Presidente Quaresma, 725 - ANDAR 1 SALA 03",59031-150
Auto Tintas,Lojas de Tintas e Pinturas,Alecrim,(84) 99908-6924,"R Presidente Sarmento, 464",59037-400
Imovest Construções,Construção Civil,Ribeira,(84) 99915-0116,"R Juvino Barreto, 257 - LJ 8 B 1 A",59012-520
Miraneide H Da Silva Confecções,Roupas e Artigos,Alecrim,(84) 3223-1336,"R Manoel Miranda, 1371",59037-250
José Maria Neves,Empresas Variadas,Lagoa Azul,(84) 3213-0002,"R Jaú, 47",59135-640
Digisound Produções,Empresas Variadas,Lagoa Nova,(84) 98112-7782,"R Romualdo Galvão, 1703 - LOJA 15 COND TRADE C",59056-100
Centro De Formação De Condutores Esperaca,Auto Escolas,Cidade da Esperança,(84) 3214-3504,"Av Rio Grande do Sul, 25",59071-300
Funerária E Floricultura Parque Das Flores,Funerárias e Velórios,Alecrim,(84) 3221-5528,"Av Almirante Alexandrino de Alencar, 424",59031-350
Aficel Factoring,Factoring e Fomento Mercantil,Tirol,(84) 99925-3639,"Av Prudente de Morais, 507 - SL 305 C",59020-900
Condomínio Themis,Condomínios,Lagoa Nova,(84) 4009-8256,"R Francisco Maia Sobrinho, 1990 - AND 6 600",59064-380
Barra Auto Peças,Autopeças e Acessórios,Pitimbu,(84) 98136-8874,"R Rio Pardo, 7695 - LJ 5",59068-350
Condomínio Esclimont,Condomínios,Barro Vermelho,(84) 3611-9248,"R Almirante Nelson Fernandes, 797",59022-600
J M Da Silva Padaria Só Massas -,Empresas Variadas,Bom Pastor,(84) 3223-9571,"Av Bom Pastor, 9 - CA",59052-080
Tropicaly Poupas De Frutas,Atacado e Fabricantes de Bebidas,Planalto,(84) 98896-0883,"R Vicente Martins Fernandes, 620",59073-168
Condomínio Residencial Luiz Matheus,Condomínios,Nova Descoberta,(84) 3611-1875,"R Theodorico Guilherme, 2189",59056-410
Jato Expresso,Aluguel de Carros,Pitimbu,(84) 99955-1047,"R Rio Coari, 7702",59068-240
K R Do Nascimento Araújo,Gráficas,Alecrim,(84) 3223-4003,"R Ary Parreiras, 1490",59040-220
Ponto Três,Roupas e Artigos,Pajuçara,(84) 98118-2093,"R Doutor Álvaro Ozório de Almeida, 286",59131-080
Casa Da Construção,Casa de Material de Construção,Planalto,(84) 3201-7873,"R Engenheiro João Hélio Alves Rocha, 1 - TV CRICIUMA",59073-070
Armarius Indústria E Comércio De Móveis,Móveis em Geral,Felipe Camarão,(84) 99915-8661,"R Ferro Cardoso, 515",59074-360
Mercadinho Santo Antônio,Distribuidores de Bebidas,Lagoa Azul,(84) 98825-1717,"R Parque Petrópolis, 24",59135-760
Marinho Imóveis,Imobiliárias,Tirol,(84) 3211-5043,"Av Prudente de Morais, 507 - sl-907",59020-900
Serigrafia W F,Roupas e Artigos,Nossa Senhora da Apresentação,(84) 99103-9472,"R São Cristóvão, 35",59114-153
Jk Gráfica Rápida,Gráficas,Pajuçara,(84) 3663-0560,"R Luzitânia, 125 - CS A",59131-090
Fhe,Eletricistas,Pajuçara,(84) 99451-1049,"R Norte Brasil, 211",59123-415
Nano Artezanatos,Comércio de Bijuterias,Ponta Negra,(84) 99982-3174,"Av Engenheiro Roberto Freire, 8000 - BOX 15 TER",59090-000
J A Bernardo Alves,Roupas e Artigos,Felipe Camarão,(84) 3202-4506,"R Rainha do Mar, 370 - CASA 518",59074-160
M L Montagem,"Conserto, Montagem, Reforma e Restauração de Móveis",Alecrim,(84) 98878-3365,"R Amaro Barreto, 1273 - AND 1 SL 3",59031-450
A C Peças E Serviços,Autopeças e Acessórios,Ribeira,(84) 3201-5557,"Tv General Glicério, 224",59012-105
Accessu Assessoria E Consultoria,Empresas Variadas,Alecrim,(84) 98824-3255,"R Desembargador Oscar Siqueira, 120",59037-630
I T Services,Suporte Técnico para Informática,Lagoa Nova,(84) 3201-2146,"R Florânia, 1762",59054-810
Petmimo,Pet Shop,Capim Macio,(84) 3012-4078,"Av Senador Salgado Filho, 2019 - POTILANDIA",59078-000
Gráfica Imprima,Gráficas,Lagoa Nova,(84) 3201-9428,"R Romualdo Galvão, 2017",59056-100
Aldkene Araújo Silva,Restaurante,Pajuçara,(84) 3663-0436,"R da Pescada, 94 - CA",59132-430
Comercial Tavares De Aves E Frios,Açougues e Frigoríficos,Nossa Senhora Apresentação,(84) 3674-5116,"Av das Fronteiras, 905 - GALPAO",59114-035
J. F Comércio E Construções,Construção Civil,Lagoa Azul,(84) 98807-2876,"Av Medellin, 1235 - A LOT BOA ESPERANCA",59139-340
Art Praia,Comércio de Bijuterias,Ponta Negra,(84) 3223-7606,"Av Erivan França, 108 - 11 12 14 15 16 17 E",59090-100
Espaço Da Beleza,Salões de Beleza e Cabeleireiros,Neópolis,(84) 3272-0052,"Av dos Ipês, 1230 - CA",59080-115
Residence Luar,Condomínios,Ponta Negra,(84) 3214-2442,"R Antônio de Nana, 45",59090-590
Clínica Dentária Popular União,Clínicas Odontológicas,Alecrim,(84) 98727-9137,"R Doutor Mário Negócio, 1398 - BL A AND 1 E 2",59040-000
E L De Moura,Supermercados,Nossa Senhora da Apresentação,(84) 99175-3529,"Av Maranguape, 4183",59114-000
Point Da Princesa Isabel,Restaurante,Cidade Alta,(84) 3212-2060,"R Princesa Isabel, 710",59025-400
O Sacolão,Lojas de Cosméticos e Perfumarias,Lagoa Nova,(84) 3215-5050,"Av Antônio Basílio, 2058",59054-380
Favoritos Supermercados,Supermercados,Capim Macio,(84) 4009-2800,"Av Engenheiro Roberto Freire, 1460",59082-400
Gilberto Veículos,Agenciamento e Desembaraço,Potengi,(84) 3214-8019,"Av Doutor João Medeiros Filho, 2877",59110-200
Real Car,Agências e Revendedores de Automóveis,Pajuçara,(84) 99971-5220,"R William Marinho de Leiros, 50 - ANEXO I LOT ALGIMAR",59133-500
Multiviga - Ind Com E Serv,Loja de Materiais Elétricos,Felipe Camarão,(84) 3205-1285,"R Assunção, 3809",59072-070
Instituto Odontológico De Natal,Consultores em Saúde e Qualidade de Vida,Cidade Alta,(84) 3206-0092,"R Gonçalves Ledo, 682 - AP 201",59025-330
Siqueira Rações,Pet Shop,Dix-sept Rosado,(84) 3213-0006,"Av Interventor Mário Câmara, 2113",59054-600
Haste - Habitação E Serviços Técnicos,Construção Civil,Capim Macio,(84) 3091-2427,"R Coronel Luciano Saldanha, 1923",59078-390
Astec - Assessoria Contábil,Contadores e Escritórios de Contabilidade,Capim Macio,(84) 3217-1617,"Av Governador José Varela, 2952 - Q 6 BL A AP 101",59078-300
Lúcia Maria Da Silva Comércio Varejista,Atacado de Produtos Alimentícios,Dix-sept Rosado,(84) 3205-1295,"Tv Jerônimo Câmara, 327 - AND 1",59063-300
Carlos Antônio De Souza,Supermercados,Cidade Nova,(84) 3205-6695,"R Augusto Calheiros, 88",59072-700
Inteligente Colégio E Curso,Escolas de Educação Infantil,Lagoa Azul,(84) 3661-2744,"Av Cidade Praia, 1188",59129-470
Parada Obrigatória,Lanchonetes,Ponta Negra,(84) 3322-0452,"R Vereador Manoel Coringa de Lemos, 67",59090-190
Luna Cosméticos,Lojas de Cosméticos e Perfumarias,Ponta Negra,(84) 98872-9001,"R Praia do Guaxinim, 8928",59094-380
Moderna Construtora,Construção Civil,Alecrim,(84) 3208-0954,"R Presidente Leão Veloso, 928",59032-500
Construtora Reta,Construção Civil,Cidade Alta,(84) 3206-3406,"Av Rio Branco, 571 - SL 312",59025-906
F Das C Ovídio,Casa de Frios e Laticínios,Potengi,(84) 99613-1615,"Av Doutor João Medeiros Filho, 3081",59120-200
Linkelo Consultoria,Laboratórios de Manipulação de Medicamentos e Cosméticos,Alecrim,(84) 3209-5900,"R dos Paianazes, 1508",59037-350
Degustare Self Service,Restaurante,Lagoa Nova,(84) 3234-3777,"Av Nascimento de Castro, 1970",59056-450
Rn Borrachas,Casa de Material de Construção,Nossa Senhora de Nazaré,(84) 3213-3010,"Av Coronel Estevam, 2810",59062-200
Cotrasa Controle De Pragas Urbanas,Dedetizadoras e Controle de Pragas,Igapó,(84) 3214-6135,"R Antônio Galdino, 324",59104-080
Contigo Corretagem E Administração De Seguros,Corretores de Seguros,Lagoa Nova,(84) 3211-3845,"Av Jerônimo Câmara, 70",59063-100
Açucena Macedo,Dermatologistas (Doenças da Pele),Tirol,(84) 3311-0600,"Tv Joaquim Fagundes, 700",59020-435
Aiane De Carvalho Costa Cavalcanti,Dentistas,Lagoa Nova,(84) 3206-0380,"Av Lima e Silva, 1611 - s-202",59075-710
Pirangi Lanches,Lanchonetes,Neópolis,(84) 98863-0755,"Av São Miguel dos Caribes,",59086-500
Rádio Nordeste,Editores de Músicas,Nordeste,(84) 3653-3315,"R Luiz XV, 10 - TERREO",59042-140
Rede Mais Zona Norte,Supermercados,Nossa Senhora de Nazaré,(84) 3661-8226,"R Cirilo Moreira, 85",59062-130
Agostinho Baterias,Autopeças e Acessórios,Nossa Senhora Nazaré,(84) 3206-2327,"Av Coronel Estevam, 2223",59062-200
Associação De Kart De Natal,Ginásios e Centros de Esportes,Alecrim,(84) 3206-4875,"Av Coronel Estevam, 1278 - SALA 105",59031-000
"Sind.dos Trab.na Ind.da Pan.conf.trigo,milho,massas Aliment.bisc.bol.mac.e Afins",Sindicatos e Federações,Alecrim,(84) 3213-4919,"Av Presidente Bandeira, 728 - AND 1",59030-200
Zelia's Confecções,Roupas e Artigos,Lagoa Nova,(84) 3213-9542,"Av Antônio Basílio, 2178 - LJ B",59054-380
Condomínio Solarcandelaria Residence,Condomínios,Candelária,(84) 3234-2209,"R Lafayete Lamartine, 1876",59064-510
Frango Brasil,Avicultura,Felipe Camarão,(84) 3205-2785,"Av Presidente Ranieri Mazzilli, 2540",59074-185
Atraente Bijuterias,Comércio de Bijuterias,Alecrim,(84) 3213-0875,"Av Presidente Bandeira, 580 - 82 578",59037-200
Est Empreendimentos,Empregadas Domésticas,Dix-sept Rosado,(84) 3234-7262,"Av Nascimento de Castro, 129 - CASA 1 BLOCO A",59054-180
Sindicoonline - Administradora Virtual,Administração de Condomínios,Tirol,(84) 3217-2357,"Av Prudente de Morais, 507 - SALA 0804",59020-900
Cabugi Embalagens,Produtos e Serviços Diversos,Candelária,(84) 98111-0299,"Av Prudente de Morais, 6399",59065-305
Sua Casa Materiais De Construção,Casa de Material de Construção,Alecrim,(84) 3343-4630,"Av Presidente Bandeira, 828",59030-200
Helsan Empreendimentos Imobiliários,Empreendimentos Imobiliários,Capim Macio,(84) 3237-0034,"R Professora Dirce Coutinho, 1958",59082-180
José Jerusamar De Sousa Fernandes Júnior,Atacado e Fabricação de Artigos de Equipamentos Esportivos,Capim Macio,(84) 3231-4560,"Av Engenheiro Roberto Freire, 2920 - LJ 57",59080-900
Posto São Luiz - Roberto Freire,Postos de Combustíveis,Capim Macio,(84) 3642-3389,"Av Engenheiro Roberto Freire, 1608",59082-400
Consórcio Ponte Da Redinha,Empresas Variadas,Cidade Alta,(84) 3202-7748,"R João Pessoa, 267 - SALA 409 - ANEXO II",59025-902
Vitrine - Limpeza De Vidros,Empregadas Domésticas,Lagoa Nova,(84) 3231-2965,"Av Nascimento de Castro, 1798",59056-450
Cil Construções E Incorporações,Empreendimentos Imobiliários,Capim Macio,(84) 3081-6830,"Av Engenheiro Roberto Freire, 1850 - LJ 14",59082-400
Reistur Operadora Fernando Noronha,Agências de Turismo e Viagens,Lagoa Nova,(84) 3206-4231,"Av Senador Salgado Filho, 1803",59056-000
Lumagy,Roupas e Artigos,Lagoa Nova,(84) 3218-4168,"R Coronel Auris Coelho, 636",59075-050
F F Azevedo,Óticas,Lagoa Nova,(84) 3231-6168,"R Desembargador Tomaz Salustino, 2024",59076-770
J.i. Sorvetes,Lanchonetes,Capim Macio,(84) 99987-3385,"Av Senador Salgado Filho, 2233 - BOX 8 V DIRETA",59078-901
J.i. Sorvetes,Lanchonetes,Capim Macio,(84) 99987-3385,"Av Senador Salgado Filho, 2233 - BOX 8 V DIRETA",59078-901
Maria Selma Alves Da Silva,Distribuidores de Bebidas,Lagoa Azul,(84) 3661-8530,"Av dos Caboclinhos, 871",59139-000
Split Machine,Assistência Técnica para Eletrônicos em Geral,Potengi,(84) 3661-2079,"R Bocaiúna, 22 - SANTAREM",59124-730
L M Processamentos,Hospedagem de Sites e Venda de Domínios,Barro Vermelho,(84) 3201-2672,"R Romualdo Galvão, 773 - SL 903",59022-100
Potengi Móveis,Móveis em Geral,Igapó,(84) 3215-9280,"R Santa Isabel, 548",59106-150
Natural Beauty,Salões de Beleza e Cabeleireiros,Ponta Negra,(84) 99990-3437,"Av Engenheiro Roberto Freire, 3112 - LJ 26 TER",59090-000
Centro Clínico Infantil,Ambulatórios,Barro Vermelho,(84) 3223-5396,"R Joaquim Fagundes, 700 - SL 3",59022-500
Galeteria Potiguar,Açougues e Frigoríficos,Pajuçara,(84) 3663-2222,"R da Cioba, 156",59133-060
Barreto & Cia,Produtos e Serviços Diversos,Tirol,(84) 99919-9539,"R Açu, 722",59020-110
R & G Assessoria Contábil,Contadores e Escritórios de Contabilidade,Capim Macio,(84) 3217-3702,"Av Ayrton Senna, 357 - SALA 22",59080-100
Arte Sobre Arte,Móveis em Geral,Pajuçara,(84) 3302-5998,"R dos Imigrantes,  - CS K 22 LOT SANTA CE",59132-690
Mais Embalagens,Papelarias,Igapó,(84) 3214-5302,"Av Bacharel Tomaz Landim, 2850",59104-212
Zuleica Peres Almeida,Roupas e Artigos,Lagoa Nova,(84) 3201-2690,"R São Pedro, 447",59054-570
Megga Brindes E Placas,Brindes,Cidade da Esperança,(84) 3205-5787,"Av Rio Grande do Sul, 48 - lj-2",59071-300
Ricardo Trigueiro Fontes,Dermatologistas (Doenças da Pele),Petrópolis,(84) 3222-1470,"R Potengi, 433",59020-030
Alvo Dedetizações,Dedetizadoras e Controle de Pragas,Lagoa Nova,(84) 3234-8391,"Av Antônio Basílio, 3895",59056-275
Frutifrios,Açougues e Frigoríficos,Cidade Nova,(84) 99112-5649,"Av Capitão-Mor Gouveia,",59070-400
Barraco São José,Lanchonetes,Candelária,(84) 3645-4873,"R Aguinaldo Gurgel Júnior, 14",59066-030
Maia & Monteiro Representações,Empresas Variadas,Candelária,(84) 3206-8680,"R Engenheiro Luciano Luiz de Barros, 3613",59064-690
Centro De Educação Infantil E Fundamental,Escolas,Tirol,(84) 3207-1548,"Av Almirante Alexandrino de Alencar, 1256 - SL 1",59015-350
Jerimum Promoções,Som e Iluminação,Lagoa Nova,(84) 3231-5198,"R Conselheiro Morton Faria, 1448 - LJ 5",59075-730
Center Vida Casa Para Idosos,Casas de Repouso,Lagoa Nova,(84) 3234-8205,"R Desembargador Adauto Maia, 1071",59054-480
Petta & Alves Advogados Associados,Escritórios de Advocacia,Capim Macio,(84) 3011-3885,"R Graciliano Ramos, 2924",59080-070
Mug Comércio E Terraplanagem,Salões de Beleza e Cabeleireiros,Pitimbu,(84) 99985-6689,"R Serra das Araras, 8020",59068-050
