Carlos Dumaresq Representações,Representações,Lagoa Nova,(84) 3234-1744,"Av Prudente de Morais, 3857 - lj-40",59056-902
Cei Unidade I E Ii,Escolas,Lagoa Nova,(84) 3089-5620,"R João Medeiros, 1976",59000-001
Sintern - Sindicato Trabalhadores Em Educação Rio Grande Norte,Sindicatos e Federações,Cidade Alta,(84) 3211-4563,"R Gonçalves Ledo, 845",59025-330
Hora Joia Variedades,Relojoarias,Cidade Alta,(84) 3221-4688,"R Vigário Bartolomeu, 629",59025-100
Rpr Contabilidade,Contadores e Escritórios de Contabilidade,Ribeira,(84) 3221-3005,"R Frei Miguelinho, 129 - s-101",59012-180
Der - Departamento De Estradas E Rodagem Rio Grande Do Norte,Administração de Rodovias,Nossa Senhora de Nazaré,(84) 3232-2312,"Av Miguel Castro, 133",59062-000
Actos Materiais Médico,Terapias Alternativas,Neópolis,(84) 3086-6108,"Av Ayrton Senna, 357 - lj-25",59088-100
Sociedade Norteriograndense De Cardiologia,Clínicos Gerais,Lagoa Nova,(84) 3201-5936,"Tv Antônio Basílio, 3025",59056-385
Paróquia De Nossa Senhora Aparecida,Igrejas e Templos,Neópolis,(84) 3615-2831,"R Rondônia, 425",59080-410
Cigarreira,Fabricantes de Bancas de Jornais e Revistas,Pitimbu,(84) 3218-6868,"R Rio Gramame,",59068-300
Tec Cell,Assistência Técnica para Celulares,Nossa Senhora de Nazaré,(84) 3231-4603,"Av Miguel Castro, 1010",59062-000
Serviço Educacional Lar E Saúde,Lojas de Artigos Religiosos,Candelária,(84) 3206-3554,"R Aníbal Correia, 1957",59064-340
Pufolândia,Móveis em Geral,Lagoa Seca,(84) 3223-4439,"Av Prudente de Morais, 2700 - sl-4",59022-305
Ubs De Lagoa Seca,Postos de Saúde,Lagoa Seca,(84) 3232-8476,"R Padre Antônio, 169",59032-230
Stecaf,Contadores e Escritórios de Contabilidade,Cidade Alta,(84) 3222-1286,"R João Pessoa, 265 - s-502 E s-503",59025-500
Amecol Materiais Hospitalares,Lojas de Artigos e Equipamentos Hospitalares,Candelária,(84) 3206-2511,"R Tiago Avico, 1823",59065-380
Ce Informar,Escolas,Pajuçara,(84) 3663-2516,"Av Moema Tinoco da Cunha Lima, 10",59133-090
Jocicross Administradora E Corretora De Seguros,Seguradoras,Cidade Alta,(84) 3201-4800,"R Princesa Isabel, 496",59025-400
Mecânica Industrial Camarada,Mecânica Industrial,Nordeste,(84) 3653-5568,"Av Felizardo Firmino Moura, 3410",59042-200
New Look,Salões de Beleza e Cabeleireiros,Cidade Alta,(84) 3211-0693,"R Princesa Isabel, 706",59025-400
Aldenira Cabeleireira Unissex,Salões de Beleza e Cabeleireiros,Lagoa Seca,(84) 3223-6999,"R Jaguarari, 1736",59032-620
Flash Distribuidora,Distribuidores de Água,Ponta Negra,(84) 3219-0794,"R Praia Jardim de Alá, 8846",59094-250
Metal Box,Metalurgia,Dix-sept Rosado,(84) 3223-6976,"Tv Baraúna, 571",59054-375
Cabo Telecom,Tv por Assinatura,Candelária,(84) 2010-2010,"R Senador José Ferreira de Souza, 1916",59064-520
Daytona Motopeças,Oficinas Mecânicas para Motos,Quintas,(84) 3653-9153,"Av Bernardo Vieira, 999",59035-015
1º Ofício De Notas De Natal,Cartórios e Tabeliães,Tirol,(84) 3222-0166,"R Mossoró, 332",59020-090
Clínica Gina De Estética,Clínicas e Centros de Estética,Potengi,(84) 3214-7256,"Av Maranguape, 2670",59112-000
Iluminar Som E Luz,Som e Iluminação,Lagoa Nova,(84) 3213-7547,"Av Amintas Barros, 3137 - lj-04",59054-830
Depósito Colinas Jiqui,Fabricação e Instalação de Lajes,Lagoa Nova,(84) 3208-2875,"Tv Santa Luzia, 104",59056-130
Centro Odontológico,Clínicas Odontológicas,Tirol,(84) 3211-2219,"R Açu, 570",59020-110
Natal Construções E Incorporações,Construção Civil,Ponta Negra,(84) 3642-2261,"Av Engenheiro Roberto Freire, 9090",59090-000
Gráfica São Lucas,Gráficas,Alecrim,(84) 3223-3688,"R Presidente Sarmento, 417",59037-400
Pc Da Tintas,Lojas de Tintas e Pinturas,Potengi,(84) 3664-1424,"Av Maranguape, 1915",59112-000
Vera Lúcia Teixeira Vasconcelos Galvão,Pediatras e Pediatria,Petrópolis,(84) 3202-1606,"R Dom José Pereira Alves, 503",59014-450
Asturiana Do Brasil,Importação e Exportação de Produtos e Serviços,Tirol,(84) 3221-3623,"Av Prudente de Morais, 744 - s-1105",59020-510
Autovia Comércio E Serviços De Automóveis,Concessionárias,Dix-sept Rosado,(84) 3213-1305,"Av Bernardo Vieira, 2060",59054-000
Clínica Hope,Laboratórios de Análises Clínicas,Cidade da Esperança,(84) 3205-7400,"R Garanhuns, 1",59070-340
Consub,Transporte Fluvial e Marítimo,Ribeira,(84) 3201-2196,"R Frei Miguelinho, 36",59012-180
Hotel Cidade Sol,Hotéis,Cidade da Esperança,(84) 3205-1893,"R Piancó, 31",59070-190
Ivanilde Garcia,Planos de Saúde e Odontológico,Ponta Negra,(84) 3082-0803,"Av Praia de Ponta Negra, 8970",59094-100
Meios - Movimento De Integração E Orientação Social,Serviços Sociais,Tirol,(84) 3211-6177,"R Apodi, 488",59020-130
Ef Contabilidade,Contadores e Escritórios de Contabilidade,Pitimbu,(84) 3218-3312,"R Lago da Pedra, 875",59068-600
Netjat Provedor,Provedores de Internet e Banda Larga,Potengi,(84) 3661-1589,"Av Itapetinga, 372",59124-400
Churrascaria Sal Da Terra,Churrascarias,Lagoa Nova,(84) 3213-3200,"Av Antônio Basílio, 1723",59054-605
Comercial Marques,Assistência Técnica para Eletrodomésticos,Lagoa Nova,(84) 3222-4645,"Av Senador Salgado Filho, 1591",59056-000
Hf Mateiral De Construção,Casa de Material de Construção,Cidade da Esperança,(84) 3205-3707,"R Adolfo Gordo, 3657",59070-100
Dimep,Comércio de Peças e Acessórios para Relógios,Quintas,(84) 3223-7488,"R Presidente Leão Veloso, 607",59035-500
Hf Mateiral De Construção,Casa de Material de Construção,Cidade da Esperança,(84) 3205-3707,"R Adolfo Gordo, 3657",59070-100
Dimep,Comércio de Peças e Acessórios para Relógios,Quintas,(84) 3223-7488,"R Presidente Leão Veloso, 607",59035-500
Ciclo Informática,Assistência Técnica para Informática,Lagoa Nova,(84) 4008-2222,"Av Senador Salgado Filho, 1605 - SL 107",59056-000
G. L. Serviços De Engenharia,Construção Civil,Lagoa Nova,(84) 3223-1245,"Av Lima e Silva, 1578 - SL 6",59075-710
Condomínio Residencial Mar Azul,Condomínios,Capim Macio,(84) 3642-1602,"R Neuza Farache, 1533 - AP 301",59082-100
Branca Rações,Pet Shop,Nossa Senhora da Apresentação,(84) 3664-4085,"R Abmael Florêncio Bernardo, 1553",59114-220
Natalgest,Administração de Condomínios,Tirol,(84) 99104-4556,"R Ângelo Varela, 1125 - SL A",59015-010
Projetus Engenharia,Construção Civil,Candelária,(84) 98822-5555,"R Coronel Joaquim Correia, 3310",59064-410
Jlt Serviços De Escritório,Empresas Variadas,Lagoa Seca,(84) 3219-4884,"R Currais Novos, 110 - APT: 802 BLOCO UNICO",59031-110
Maria Aparecida Alves De Medeiros,Farmácias e Drogarias,Nossa Senhora de Nazaré,(84) 3223-0030,"Av Miguel Castro, 702",59062-000
F. C. Moto Peças,Peças e Acessórios para Motos,Potengi,(84) 3662-7336,"Av Governador Antônio de Melo e Souza, 1832",59125-090
Galvão Gás,Distribuidores de Bebidas,Neópolis,(84) 98103-2462,"R Arapiraca, 4142",59086-210
Jpm Alumínio,Esquadrias,Pitimbu,(84) 3606-0817,"R Irineu Costa, 132",59066-280
José Nilson Representações,Artigos e Equipamentos para Lojas em Geral,Capim Macio,(84) 99145-3145,"Av Santos Dumont, 424",59078-200
Atrios,"Ampliações, Cópias e Revelações de Fotos",Potengi,(84) 3217-5150,"Av Doutor João Medeiros Filho, 2300 - LJ 1",59120-555
Vivarte Variedades,Floriculturas,Cidade Alta,(84) 3201-0706,"R Felipe Camarão, 578",59025-200
Condomínio Residencial Aluísio Bezerra,Condomínios,Petrópolis,(84) 3202-3204,"R Enéas Reis, 762",59020-020
Bamboo Flat,Apart Hotéis,Ponta Negra,(84) 3641-3439,"R Vereador Manoel Coringa de Lemos, 401",59090-190
Condomínio Residencial Abalone,Condomínios,Nova Descoberta,(84) 3344-3804,"R Doutor Israel Nunes, 1724 - AP 302",59056-370
Modesty,Distribuidores de Produtos Médicos e Hospitalares,Cidade Alta,(84) 3211-6806,"R Ulisses Caldas, 272 - SL 7",59025-090
Coco Verde,Albergues,Ponta Negra,(84) 99431-1288,"R Doutor Manoel Augusto Bezerra de Araújo, 180 - AP 10",59090-430
Freesol It Solutions,Hospedagem de Sites e Venda de Domínios,Tirol,(84) 3221-0206,"Av Rodrigues Alves, 930 - SL 215",59020-200
Rebral Representações Brasil,Atacado de Produtos Alimentícios,Alecrim,(84) 99902-0037,"R Presidente Quaresma, 588",59031-150
José Gomes De Queiroz Comercial,Sacolões Hortifrutigrangeiros,Lagoa Nova,(84) 3211-0294,"Av Capitão-Mor Gouveia, 3005 - 4 BOX A 35",59076-400
Naldo Ciclo,Bicicletarias,Lagoa Azul,(84) 3221-4442,"R Penápolis, 251 - LATERAL",59135-680
Francisco Alcídes Azevedo De Paula,Escolas,Potengi,(84) 99418-2899,"Pc Caucaia, 34",59129-785
Centro Educacional Participação,Escolas de Educação Infantil,Potengi,(84) 3614-7813,"R Bragantina, 149",59124-530
Sociedade De Nefrologia,Associações Sociais,Tirol,(84) 3201-2388,"R Jundiaí, 654",59020-120
Baby & Kids,Roupas e Artigos,Petrópolis,(84) 3211-7920,"Av Afonso Pena, 624",59020-065
Sabor Da Terra,Restaurante,Lagoa Nova,(84) 3223-7016,"Av Nascimento de Castro, 1685 - SL 3",59056-450
Uilma Duarte Da Silva,Lojas de Colchões,Alecrim,(84) 3213-5636,"R Presidente Quaresma, 424",59031-150
Spm Cirúrgica,Lojas de Produtos Ortopédicos,Lagoa Nova,(84) 3343-0622,"Av Lima e Silva, 1497 - LOJA: 101 BIO HALL E",59075-710
Fabíola Sampaio Studio Hair,Salões de Beleza e Cabeleireiros,Alecrim,(84) 3223-3291,"Av Coronel Estevam, 1448 - ANDAR: 1;",59037-000
Associação De Hospitais Do Rio Grande Do Norte Ahorn,Associações Sociais,Petrópolis,(84) 3202-3748,"R Coronel Joaquim Manoel, 717 - SL 419",59012-330
Drogaria E Convenincia Dose Certa,Farmácias e Drogarias,Cidade Alta,(84) 3614-9305,"R Avaí, 359 - CAC",59025-763
Tan,Associações Sociais,Ribeira,(84) 3201-4692,"R Ferreira Chaves, 98 - AND 1 SL 2 E 3",59012-030
M D N Empreendimentos,Atacado e Fabricação de Confecções Unissex,Ponta Negra,(84) 99481-7020,"R Manoel Avelino Sobrinho, 685",59091-030
Palácio Das Construções,Casa de Material de Construção,Nossa Senhora da Apresentação,(84) 3221-0066,"R Severino Tavares, 261",59114-840
Depósito Santo Cristo,Casa de Material de Construção,Bom Pastor,(84) 99949-9408,"Av Lima e Silva, 135",59060-215
Bárbara Variedades,Roupas e Artigos,Alecrim,(84) 3613-2085,"R dos Caicós, 1647",59037-700
Cantina Brazinho,Supermercados,Alecrim,(84) 3213-1752,"R Manoel Miranda, 351",59037-250
Jaguari,Mão de Obra Temporária,Cidade Alta,(84) 3201-5456,"R Princesa Isabel, 523 - AN 3 SALA 311 GALERI",59025-400
Gamboa,Construção Civil,Potengi,(84) 99985-3596,"Av Apucarana, 1308 - FDS",59124-000
Petra Construções,Construção Civil,Santos Reis,(84) 3211-1089,"R Otoniel Menezes, 96",59010-510
Super Vem,Atacado de Produtos Alimentícios,Nossa Senhora de Nazaré,(84) 99155-0102,"Tv Leopoldo Bretano, 156",59060-495
Leonia Pronta Entrega,Comércio de Roupas,Potengi,(84) 3661-3849,"R Lagoa de Patos, 1173",59129-090
Hajan Comércio E Representações,Supermercados,Capim Macio,(84) 3219-5144,"R Major Jorge Martiniano, 322",59082-360
Hajan Comércio E Representações,Supermercados,Capim Macio,(84) 3219-5144,"R Major Jorge Martiniano, 322",59082-360
Ravelli Representação,Artigos e Equipamentos para Lojas em Geral,Lagoa Nova,(84) 3205-1688,"R Ministro Macedo Soares, 47",59076-660
L C Empreendimentos Imobiliários,Empreendimentos Imobiliários,Lagoa Nova,(84) 99103-4642,"Av Lima e Silva, 1578 - SL 7",59075-710
Panificadora São Severino Dos Ramos,Padarias e Confeitarias,Nossa Senhora da Apresentação,(84) 3214-2857,"R Gadelha, 18",59114-110
Meios - Movimento De Integração E Orientação Social,Secretarias Públicas,Nossa Senhora de Nazaré,(84) 3223-2555,"Av Miguel Castro, 706",59062-000
Panificadora Yasmin,Padarias e Confeitarias,Nossa Senhora de Nazaré,(84) 3213-3809,"Av Miguel Castro, 120",59062-000
Atual Serviços De Contabilidade,Contadores e Escritórios de Contabilidade,Lagoa Nova,(84) 3081-1567,"Av Amintas Barros, 2793",59054-830
Ls Material De Construção,Casa de Material de Construção,Pajuçara,(84) 3091-1553,"Av Comunidade em Ação, 50 - LOT JARDIM BRASIL",59131-515
Bar Do Thomas,Bares,Capim Macio,(84) 3231-1255,"Av das Tulipas, 169 - A CONJ RESID MIRASSO",59078-220
Motta's Eventos,"Serviços de Áudio, Foto e Vídeo Filmagem",Candelária,(84) 99612-6867,"R Raimundo Chaves, 2000 - RSIDENCIA",59064-390
Clinesp Clínica Esperança,Ambulatórios,Cidade da Esperança,(84) 3221-0066,"Av Paraíba, 128 - CA",59070-200
Inforcop,Papelarias,Lagoa Nova,(84) 3082-1562,"Av Senador Salgado Filho, 1607",59056-000
W G Comercial,Comércio de Madeiras,Igapó,(84) 3662-4064,"Av Doutor João Medeiros Filho, 871 - LOTE A",59104-200
Mining Ventures Brasil Pesquisa E Mineração,Geólogos,Ponta Negra,(84) 3201-2919,"R Porto das Oficinas, 8960",59094-300
Única Propaganda,Agências de Publicidade e Propaganda,Candelária,(84) 3234-7093,"R José do Patrocínio, 3430",59065-210
S5natra's 2ara62e,Bares,Ponta Negra,(84) 3236-2393,"R Doutor Manoel Augusto Bezerra de Araújo, 130",59090-430
Brasil Grill,Restaurante,Ponta Negra,(84) 3219-5012,"Av Engenheiro Roberto Freire, 8790 - D 14",59090-000
Karina Rose Cavalcante Advogados Associados,Escritórios de Advocacia,Tirol,(84) 3344-5329,"R Doutor Jacob Wolfson, 642",59020-070
Ronaldo L. Correia,Móveis em Geral,Alecrim,(84) 3201-3359,"R Amaro Barreto, 1247 - SL 104",59031-450
Só Constrói Construção Civil,Construção Civil,Capim Macio,(84) 3207-6761,"Av Professor João Machado, 2884 - SL 2",59078-340
M C K Construções,Empresas Variadas,Neópolis,(84) 99640-2726,"Av das Alagoas, 39 - CS C",59086-200
Ótica Multivisão,Óticas,Igapó,(84) 3614-8488,"Av Doutor João Medeiros Filho, 691",59104-200
Mundo Das Utilidades,Armarinhos e Aviamentos,Igapó,(84) 3272-2299,"Av Bacharel Tomaz Landim, 2760 - LJ A",59104-212
Aliança Consultoria,Consultores em Informática,Candelária,(84) 3206-2737,"R São José, 3205",59064-150
Lady Pink,Lojas de Roupas Femininas,Alecrim,(84) 3213-6690,"R Leonel Leite, 1377 - lj-105A",59037-820
Letra Corretora De Seguros,Corretores de Seguros,Lagoa Nova,(84) 3201-2300,"Av Senador Salgado Filho, 1595 - And-1 s-104",59056-000
Chokante,Lojas de Roupas Unissex,Alecrim,(84) 3223-3803,"R Amaro Barreto, 1279",59031-450
Gustavo Cardoso Dos Santos,Funilaria e Pintura,Lagoa Azul,(84) 98852-1030,"Av Moema Tinoco da Cunha Lima, 2516",59136-245
Felipe Vasconcelos Ferreira,Suporte Técnico para Informática,Neópolis,(84) 3217-6183,"R Itaguara, 4734 - CA",59088-140
Luiz Cardoso Ferreira Júnior,Funilaria e Pintura,Bom Pastor,(84) 99912-5752,"R Aristófanes Fernandes, 334",59050-240
Mariana Silva De Melo,Suporte Técnico para Informática,Nossa Senhora da Apresentação,(84) 3664-0289,"Tv Boa Sorte, 70",59114-255
Esa Informática,Suporte Técnico para Informática,Tirol,(84) 2030-1818,"Av Afonso Pena, 1206",59020-100
João Avelino Barbosa Filho,Bares,Mãe Luíza,(84) 98853-5426,"R João XXIII, 228 - CSB",59014-000
Prosission,Lojas de Cosméticos e Perfumarias,Felipe Camarão,(84) 3205-4074,"R Santa Clara, 697",59072-470
Adriana Barbosa Souza,Distribuidores de Bebidas,Candelária,(84) 99915-5603,"R Barão de Serra Branca, 1851 - SLJ ;SALA 1",59065-550
Selma Maria Cardoso Dos Anjos,Lavanderias,Felipe Camarão,(84) 98866-4496,"R Professor Antônio Trigueiro, 100",59074-100
Flávia Galdino Ferreira,Salões de Beleza e Cabeleireiros,Capim Macio,(84) 3082-8201,"R Bacharel Francisco Menezes de Melo, 90 - LJ 5 E 6",59082-354
Jr Equipadora,Autopeças e Acessórios,Nordeste,(84) 3653-5946,"R Ebenézer, 808 - CS 808",59042-290
Maria Do Socorro De Queiroz Olímpio,Bares,Cidade da Esperança,(84) 3205-2038,"R Porto Alegre, 16",59071-390
William Paulo De Sousa Silva,Suporte Técnico para Informática,Redinha,(84) 3661-5043,"Av Doutor João Medeiros Filho, 3740 - CS A",59122-200
Dulcineide Martins Pereira,Bares,Cidade Alta,(84) 99925-4951,"Av Câmara Cascudo, 228 - AND 1",59025-280
Marcenaria Fan Móveis,Móveis em Geral,Pitimbu,(84) 3218-3372,"R Rio Guaju, 7755",59068-370
Adelmara Geórgia E Silva Melo,Distribuidores de Bebidas,Lagoa Azul,(84) 3662-0566,"Av dos Caboclinhos, 1070",59139-000
Ranicleia Pereira Da Silva,Salões de Beleza e Cabeleireiros,Ponta Negra,(84) 99461-7307,"Av Praia de Ponta Negra, 8956 - SL 1 E 2",59094-100
Milena Karla Rodrigues Da Silva,Salões de Beleza e Cabeleireiros,Alecrim,(84) 3223-2789,"R Sátiro Dias, 1482",59040-240
Cláudio De Barros Azevedo,Lojas de Cosméticos e Perfumarias,Candelária,(84) 99418-1644,"R Jaguarari, 2604 - LT 16",59064-500
Nazareno Bernardino De Melo,Centros Automotivos,Planalto,(84) 99414-9281,"R Mira Mangue, 306 - AND 1",59073-230
5àsec,Lavanderias,Capim Macio,(84) 3207-2175,"Av Engenheiro Roberto Freire, 2824 - lj-1",59082-400
Francisco Deliato De Freitas,Centros Automotivos,Bom Pastor,(84) 98877-5960,"R Francisco Cunha, 16",59060-270
Neoface Cirurgia Oral E Maxilofacial,Clínicas Odontológicas,Barro Vermelho,(84) 99600-0072,"R Vale de Miranda, 1361 - BL C AP 304",59022-190
Dpil,Salões de Beleza e Cabeleireiros,Lagoa Nova,(84) 99914-8149,"Av Amintas Barros, 2503",59054-465
Academia Flash,Academias de Ginástica,Lagoa Azul,(84) 98801-5533,"Av dos Caboclinhos, 1072",59139-000
Das Transportes De Cargas,"Fretes, Cargas e Encomendas",Ribeira,(84) 3025-7552,"R Frei Miguelinho, 46",59012-180
Sivonaldo Martins Da Silva,Centros Automotivos,Pajuçara,(84) 98819-1886,"Av Governador Antônio de Melo e Souza, 2085 - CS C",59123-030
Helena Theobaldo Cosme Da Silva,Livrarias,Nossa Senhora da Apresentação,(84) 99138-8059,"Tv Santa Efigênia, 53",59114-054
Rosangela Pereira Da Silva,Salões de Beleza e Cabeleireiros,Felipe Camarão,(84) 98874-2240,"R Santa Cristina, 40",59072-150
Helena Theobaldo Cosme Da Silva,Livrarias,Nossa Senhora da Apresentação,(84) 99138-8059,"Tv Santa Efigênia, 53",59114-054
Rosangela Pereira Da Silva,Salões de Beleza e Cabeleireiros,Felipe Camarão,(84) 98874-2240,"R Santa Cristina, 40",59072-150
Erberson Silva Da Costa,Distribuidores de Gás,Felipe Camarão,(84) 3205-5837,"R Santa Joana D''Arc, 746",59074-380
Handerson César Da Cunha Albuquerque,Suporte Técnico para Informática,Pitimbu,(84) 99198-7274,"R Doutor Francisco Sá, 275",59069-080
Sarleno Soares Lopes,Autopeças e Acessórios,Nossa Senhora da Apresentação,(84) 3664-3850,"R Miracema do Norte, 248",59114-590
Maxcia Milena Machado Da Silva,Aluguel de Roupas,Potengi,(84) 98851-6221,"R Seara, 2962",59110-320
Israel Félix De Lima Júnior,Salões de Beleza e Cabeleireiros,Neópolis,(84) 3217-2173,"R Minas Gerais, 239",59080-370
Paulo Cezar Campos Do Vale,Suporte Técnico para Informática,Alecrim,(84) 99131-8422,"R dos Paianazes, 1721 - B 1",59035-350
Anderson Luiz Soares Leão,Roupas e Artigos,Lagoa Nova,(84) 3234-0912,"Av Prudente de Morais, 3857",59056-902
La - Biostetic,Academias de Ginástica,Capim Macio,(84) 99908-2634,"R Abraham Tahim, 1600",59082-160
Joabe Gás,Distribuidores de Gás,Lagoa Azul,(84) 3614-0225,"Av Bumba-Meu-Boi, 1200 - CONJ NOVA NATAL",59135-000
Nilma Trajano Da Cruz,Lojas de Cosméticos e Perfumarias,Ponta Negra,(84) 3088-0613,"R da Floresta, 379",59090-260
Marcone De Oliveira Sousa,Serralherias e Serralheiros,Rocas,(84) 98821-3572,"R Mestre Lucarino, 549 - ANEXO",59010-310
Mt Assessoria Contábil,Contadores e Escritórios de Contabilidade,Lagoa Nova,(84) 3234-3960,"R Tereza Campos, 2",59062-530
Tayo Restaurante Japonês,Restaurante,Ponta Negra,(84) 3236-2785,"R Pedro Fonseca Filho, 8920 - lj-7",59090-080
Hyundai Caoa,Concessionárias,Lagoa Nova,(84) 2010-1111,"Av Prudente de Morais, 4011",59056-200
Mércia Do Nascimento Chacon,Salões de Beleza e Cabeleireiros,Lagoa Azul,(84) 99687-3167,"R Eldorado, 72",59135-340
O Produtor,Sacolões Hortifrutigrangeiros,Cidade Nova,(84) 99931-1010,"Av Capitão-Mor Gouveia,",59070-400
Superbanca,Jornais e Revistas,Tirol,(84) 3231-2237,"Av Senador Salgado Filho, 731 - lj-552",59015-000
Hotel Sezimbra,Hotéis,Ponta Negra,(84) 3641-1549,"R Vereador Manoel Coringa de Lemos, 425",59090-190
Condomínio Residencial Parque Tarumã,Imobiliárias,Nova Descoberta,(84) 3206-3562,"R Claudionor de Andrade, 1991 - BL C AP 1991",59075-350
Ótica Mirim,Óticas,Cidade Alta,(84) 3084-2362,"R Felipe Camarão, 478 - LJ 6",59025-200
Camel Empreendimentos Imobiliários,Construção Civil,Ribeira,(84) 3221-1242,"R Frei Miguelinho, 18",59012-180
Associação Família Espírita Seareiros Do Amanhã,Casas de Repouso,Neópolis,(84) 3084-5005,"R Governador Valadares, 4861",59088-010
Delícias Do Garfield,Lanchonetes,Neópolis,(84) 99129-6395,"Al das Cerejeiras, 298",59080-360
Churrasketto,Serviços de Alimentação,Tirol,(84) 3221-0984,"R Mossoró, 752",59020-090
Satoru Shimosaki,Floriculturas,Petrópolis,(84) 3202-3251,"Av Hermes da Fonseca, 385 - BL C AP 105",59014-165
Morada Empreendimentos,Construção Civil,Cidade Alta,(84) 3614-1609,"R João Pessoa, 267 - SALA 607 EDIF CIDADE",59025-902
Clínica Menino Jesus,Ambulatórios,Cidade Alta,(84) 3346-3163,"R Princesa Isabel, 850 - SALA 02",59025-400
Copytek,Assistência Técnica para Informática,Ribeira,(84) 3202-7927,"Av Duque de Caxias, 202",59012-200
Condontec,Arquitetos,Cidade Alta,(84) 3236-2656,"R Ulisses Caldas, 193 - SL 214",59025-090
Cerimoniais.com,Cerimonial e Mestre de Cerimônia,Lagoa Nova,(84) 3206-2015,"R São José, 1993",59054-630
A&r Serviços,Transporte Rodoviário,Santos Reis,(84) 3202-7799,"R da Esperança, 75",59010-390
N.a.b,Imobiliárias,Petrópolis,(84) 3202-4450,"R Seridó, 555 - SL 10",59020-010
Peixoto De Araújo - Advogados,Escritórios de Advocacia,Lagoa Nova,(84) 3611-1655,"Av Miguel Castro, 1162 - SL 2 3",59075-740
Delicias.com,Lanchonetes,Alecrim,(84) 3222-3676,"R Leonel Leite, 1377 - LJ C 202 10",59037-820
B. I. Prestações De Serviços De Microfilmagens,Radiologia e Diagnóstico por Imagem,Tirol,(84) 3201-2419,"R São Joaquim, 318 - SL 1",59022-240
Uniclínica Profemme,Ambulatórios,Candelária,(84) 3202-4151,"R São José, 2189",59064-150
Infosoft Web Solutions,Web Designer e Desenvolvimento de Sites,Petrópolis,(84) 3234-3090,"R Tuiuti, 264",59014-160
Multi Sport's,Produtos e Serviços Diversos,Ponta Negra,(16) 3726-3227,"Av Engenheiro Roberto Freire, 3176",59090-000
Manoel Vidal Barbalho,Casa de Material de Construção,Felipe Camarão,(84) 3086-6774,"R Padre Cícero, 12",59072-433
Regina Borges Tinoco,Ginecologistas,Felipe Camarão,(84) 3221-6301,"R Felipe Camarão, 548",59072-740
Autosseis Veículos,Agências e Revendedores de Automóveis,Cidade Nova,(84) 3213-7856,"R São José, 22",59072-640
F Campelo Melo Com E Repres,Representações,Lagoa Nova,(84) 3231-4459,"Av Prudente de Morais, 3857 - lj-52",59056-902
Arituba Turismo,Agências de Turismo e Viagens,Tirol,(84) 3133-3880,"Av Hermes da Fonseca, 1542",59020-650
Copm - Clube Dos Oficiais Da Polícia Militar,Clubes e Estádios,Tirol,(84) 3211-5056,"Vl General João Varela,",59020-410
Jmt Locações,Mão de Obra Terceirizada,Lagoa Nova,(84) 3234-1139,"R São José, 2090",59063-150
Cedro,Casa de Material de Construção,Ribeira,(84) 3211-8046,"R Princesa Isabel, 333 - s-1",59012-400
Varejão Dos Medicamentos,Distribuidores de Medicamentos,Igapó,(84) 3661-2480,"R Havaí, 359",59000-001
Roland Transportes,Transporte Rodoviário,Pitimbu,(84) 3218-6107,"Av dos Xavantes, 200",59067-600
Prevent Segurança E Medicina Do Trabalho,Medicina do Trabalho,Capim Macio,(84) 3615-2137,"Av Ayrton Senna, 357 - lj-40",59080-100
Center Service,Fabricação e Equipamentos para Cozinha,Alecrim,(84) 3213-0547,"R dos Canindés, 1501",59030-600
Equipadora Tem Tem,Autopeças para Caminhões,Quintas,(84) 3653-9023,"R dos Pegas, 1983",59035-100
Nordeste Cartuchos,Recarga de Cartuchos e Toner para Impressoras,Igapó,(84) 3614-0101,"Av Bacharel Tomaz Landim, 2010",59104-228
Meios - Movimento De Integração E Orientação Social,Secretarias Públicas,Dix-sept Rosado,(84) 3205-0160,"R dos Caicós, 2002",59052-700
Autoesporte Veículos,Centros Automotivos,Lagoa Seca,(84) 3653-5868,"Av Presidente Bandeira, 1276",59032-170
Supremo Conselho Do Estado Do Rio Grande Do Norte,Associações Beneficentes,Lagoa Nova,(84) 3222-1119,"R Romualdo Galvão, 891",59056-100
Zastrais,Lojas de Roupas Unissex,Tirol,(84) 3201-1482,"R Apodi, 500 - lj-9",59020-130
A Chaves Guinchos,Guincho e Reboque,Nossa Senhora de Nazaré,(84) 3205-5485,"R Jardim Brasília, 250",59060-440
Avohai,Lojas de Roupas Unissex,Ribeira,(84) 3215-0518,"R Doutor Barata, 159",59012-370
Mic Turismo,Agências de Turismo e Viagens,Lagoa Nova,(84) 3611-0677,"Av Rui Barbosa, 911",59056-300
Ecocentro,Radiologia e Diagnóstico por Imagem,Tirol,(84) 3201-2519,"R Governador Juvenal Lamartine, 205",59020-280
Engeo Fundações,Fundações para Construções,Petrópolis,(84) 3202-0933,"R Coronel Joaquim Manoel, 717 - s-511",59012-330
Natal Property,Imobiliárias,Lagoa Nova,(84) 3206-3399,"Av Nascimento de Castro, 1805 - lj-8",59056-450
Claudi Móveis Ambientes,Móveis em Geral,Capim Macio,(84) 3236-3000,"Av Engenheiro Roberto Freire,",59082-400
Millennium Salão De Beleza,Salões de Beleza e Cabeleireiros,Neópolis,(84) 3208-4649,"Av Ayrton Senna, 1410 - lj-B",59088-100
Avohai,Mão de Obra Terceirizada,Ribeira,(84) 3215-0514,"R Doutor Barata, 187",59012-370
Bar Mocidade Independente,Casas Noturnas,Alecrin,(84) 3201-1680,"R Fonseca e Silva, 1094",59040-270
Salabona,Restaurante,Barro Vermelho,(84) 4141-3898,"R Antônio Melo, 1215 - lj-5",59030-470
Clínica Apodi,Clínicos Gerais,Tirol,(84) 3201-8000,"R Apodi, 594",59020-130
Frutiefrios,Sacolões Hortifrutigrangeiros,Cidade Nova,(84) 3206-6075,"Av Capitão-Mor Gouveia,  - lj-11",59070-400
Ana Boutique,Bazares e Boutiques,Petrópolis,(84) 3221-5461,"Av Nilo Peçanha, 295",59012-300
Samurai,Conserto de Máquinas Fotográficas,Capim Macio,(84) 3207-2034,"Av Engenheiro Roberto Freire, 2951 - bl-4 lj-9",59078-600
Multiplacas,Sistemas de Sinalização,Lagoa Nova,(84) 3206-9471,"R São José, 1945",59054-630
